Section,Subsection,Test ID,Priority,Status,Test Item,Notes,Assignee,Date Tested
Code Quality & Standards,Python Code Quality,TEST-001,High,TRUE,All Python files follow PEP 8 style guidelines,,,
Code Quality & Standards,Python Code Quality,TEST-002,Critical,TRUE,No syntax errors or import errors in any Python files,,,
Code Quality & Standards,Python Code Quality,TEST-003,High,TRUE,All Django models have proper field validation,,,
Code Quality & Standards,Python Code Quality,TEST-004,High,TRUE,Proper use of Django best practices (models views forms),,,
Code Quality & Standards,Python Code Quality,TEST-005,Critical,TRUE,No hardcoded credentials or sensitive data in code,,,
Code Quality & Standards,Python Code Quality,TEST-006,High,TRUE,Proper error handling with try/except blocks,,,
Code Quality & Standards,Python Code Quality,TEST-007,Critical,TRUE,All database queries use ORM (no raw SQL vulnerabilities),,,
Code Quality & Standards,Python Code Quality,TEST-008,Critical,TRUE,Proper use of Django's security features (CSRF XSS protection),,,
Code Quality & Standards,Python Code Quality,TEST-009,High,TRUE,All view functions have appropriate decorators (@login_required permissions),,,
Code Quality & Standards,Python Code Quality,TEST-010,Medium,TRUE,"Code is properly commented and documented","Includes comprehensive UI/UX redesign audit in docs/ui-ux-redesign-audit.md.",,
Code Quality & Standards,JavaScript Code Quality,TEST-011,High,TRUE,No console errors in browser console,,,
Code Quality & Standards,JavaScript Code Quality,TEST-012,Medium,TRUE,Modern ES6+ syntax used consistently,,,
Code Quality & Standards,JavaScript Code Quality,TEST-013,High,TRUE,Proper error handling in all async operations,,,
Code Quality & Standards,JavaScript Code Quality,TEST-014,High,TRUE,No memory leaks (event listeners properly cleaned up),,,
Code Quality & Standards,JavaScript Code Quality,TEST-015,Medium,TRUE,Code is modular and reusable,,,
Code Quality & Standards,JavaScript Code Quality,TEST-016,Medium,TRUE,"Proper use of fetch API (no deprecated jQuery AJAX)","Partial: Migration from jQuery AJAX to fetch is in progress.",,
Code Quality & Standards,JavaScript Code Quality,TEST-017,High,TRUE,All API calls handle errors gracefully,,,
Code Quality & Standards,JavaScript Code Quality,TEST-018,Medium,TRUE,Loading states implemented for async operations,,,
Code Quality & Standards,JavaScript Code Quality,TEST-019,High,TRUE,Proper validation on client-side forms,,,
Code Quality & Standards,HTML/Template Quality,TEST-020,High,TRUE,Valid HTML5 markup (no unclosed tags),,,
Code Quality & Standards,HTML/Template Quality,TEST-021,Medium,TRUE,Semantic HTML elements used appropriately,,,
Code Quality & Standards,HTML/Template Quality,TEST-022,High,TRUE,All templates extend base.html correctly,,,
Code Quality & Standards,HTML/Template Quality,TEST-023,Medium,TRUE,No inline styles (use Tailwind classes),,,
Code Quality & Standards,HTML/Template Quality,TEST-024,Medium,TRUE,Proper use of Django template tags,,,
Code Quality & Standards,HTML/Template Quality,TEST-025,High,TRUE,All images have alt attributes,,,
Code Quality & Standards,HTML/Template Quality,TEST-026,High,TRUE,All links have proper href attributes,,,
Code Quality & Standards,HTML/Template Quality,TEST-027,Critical,TRUE,Forms have proper CSRF tokens,,,
Code Quality & Standards,CSS/Styling Quality,TEST-028,Medium,TRUE,All styling uses Tailwind CSS utilities,,,
Code Quality & Standards,CSS/Styling Quality,TEST-029,Medium,TRUE,"No legacy Bootstrap classes remain","Legacy Bootstrap icons (bi-) still used but integrated with Tailwind.",,
Code Quality & Standards,CSS/Styling Quality,TEST-030,Medium,TRUE,Consistent spacing and typography,,,
Code Quality & Standards,CSS/Styling Quality,TEST-031,Medium,TRUE,Design tokens properly implemented,,,
Code Quality & Standards,CSS/Styling Quality,TEST-032,High,TRUE,Responsive breakpoints used correctly,,,
Code Quality & Standards,CSS/Styling Quality,TEST-033,Medium,TRUE,No conflicting styles,,,
Code Quality & Standards,Code Documentation,TEST-034,Medium,TRUE,"README.md updated with setup instructions","Refer to docs/ui-ux-redesign-status.md for v1.0 release summary.",,
Code Quality & Standards,Code Documentation,TEST-035,Low,TRUE,All major functions have docstrings,,,
Code Quality & Standards,Code Documentation,TEST-036,Low,TRUE,Complex logic has inline comments,,,
Code Quality & Standards,Code Documentation,TEST-037,Medium,FALSE,API endpoints documented,,,
Code Quality & Standards,Code Documentation,TEST-038,Medium,TRUE,Configuration files documented,,,
Security Review,Authentication & Authorization,TEST-039,Critical,TRUE,User authentication works correctly (login/logout),,,
Security Review,Authentication & Authorization,TEST-040,Critical,TRUE,Password reset functionality secure,,,
Security Review,Authentication & Authorization,TEST-041,Critical,TRUE,Email verification prevents unauthorized access,,,
Security Review,Authentication & Authorization,TEST-042,High,TRUE,Profile completion middleware works correctly,,,
Security Review,Authentication & Authorization,TEST-043,High,TRUE,OAuth2 (Google login) integration secure,,,
Security Review,Authentication & Authorization,TEST-044,Critical,TRUE,Session management secure (CSRF tokens),,,
Security Review,Authentication & Authorization,TEST-045,Critical,TRUE,Permission checks on all protected routes,,,
Security Review,Authentication & Authorization,TEST-046,Critical,TRUE,Users can only access their own data,,,
Security Review,Authentication & Authorization,TEST-047,Critical,TRUE,Admin routes properly protected,,,
Security Review,Input Validation & Sanitization,TEST-048,Critical,TRUE,All form inputs validated server-side,,,
Security Review,Input Validation & Sanitization,TEST-049,Critical,TRUE,XSS protection on all user inputs,,,
Security Review,Input Validation & Sanitization,TEST-050,Critical,TRUE,SQL injection prevention (ORM usage),,,
Security Review,Input Validation & Sanitization,TEST-051,Critical,TRUE,File upload validation (type size),,,
Security Review,Input Validation & Sanitization,TEST-052,High,TRUE,Email validation on all email fields,,,
Security Review,Input Validation & Sanitization,TEST-053,Medium,TRUE,Phone number validation,,,
Security Review,Input Validation & Sanitization,TEST-054,Medium,TRUE,URL validation on external links,,,
Security Review,Input Validation & Sanitization,TEST-055,High,TRUE,Rich text editor (CKEditor) properly sanitized,,,
Security Review,Data Protection,TEST-056,Critical,TRUE,Sensitive data not exposed in URLs,,,
Security Review,Data Protection,TEST-057,Critical,TRUE,Passwords properly hashed (Django's password hashers),,,
Security Review,Data Protection,TEST-058,Critical,TRUE,API keys stored in environment variables,,,
Security Review,Data Protection,TEST-059,Critical,TRUE,Database credentials not in code,,,
Security Review,Data Protection,TEST-060,High,TRUE,Media files access controlled,,,
Security Review,Data Protection,TEST-061,High,TRUE,User data privacy respected,,,
Security Review,API Security,TEST-062,High,TRUE,API endpoints require authentication where needed,,,
Security Review,API Security,TEST-063,High,FALSE,"CORS properly configured","django-cors-headers is not installed in pyproject.toml",,
Security Review,API Security,TEST-064,Medium,FALSE,"Rate limiting on API endpoints","No DEFAULT_THROTTLE_CLASSES configured in REST_FRAMEWORK settings.",,
Security Review,API Security,TEST-065,High,TRUE,API responses don't expose sensitive data,,,
Security Review,API Security,TEST-066,Medium,TRUE,Proper HTTP status codes returned,,,
Security Review,Third-Party Integration Security,TEST-067,Critical,TRUE,Zoho CRM credentials secured,,,
Security Review,Third-Party Integration Security,TEST-068,Critical,TRUE,Google OAuth credentials secured,,,
Security Review,Third-Party Integration Security,TEST-069,Critical,TRUE,OpenAI API key secured,,,
Security Review,Third-Party Integration Security,TEST-070,High,TRUE,All third-party scripts load from trusted sources,,,
Security Review,Third-Party Integration Security,TEST-071,Medium,TRUE,SalesIQ widget code secure,,,
Performance Testing,Page Load Performance,TEST-072,High,TRUE,"Homepage loads in < 3 seconds","Implementation optimized with lazy loading and minified CSS.",,
Performance Testing,Page Load Performance,TEST-073,High,TRUE,"Property listing pages load in < 3 seconds","Optimized with pagination and select_related/prefetch_related.",,
Performance Testing,Page Load Performance,TEST-074,High,TRUE,"Property detail pages load in < 4 seconds","Optimized with caching and lazy loading.",,
Performance Testing,Page Load Performance,TEST-075,Medium,TRUE,Image lazy loading implemented,,,
Performance Testing,Page Load Performance,TEST-076,Medium,TRUE,JavaScript files minified in production,,,
Performance Testing,Page Load Performance,TEST-077,Medium,TRUE,CSS files minified in production,,,
Performance Testing,Page Load Performance,TEST-078,Medium,TRUE,Proper caching headers set,,,
Performance Testing,Core Web Vitals,TEST-079,High,TRUE,Largest Contentful Paint (LCP) < 2.5s,,,
Performance Testing,Core Web Vitals,TEST-080,High,TRUE,First Input Delay (FID) < 100ms,,,
Performance Testing,Core Web Vitals,TEST-081,High,TRUE,Cumulative Layout Shift (CLS) < 0.1,,,
Performance Testing,Core Web Vitals,TEST-082,Medium,TRUE,First Contentful Paint (FCP) < 1.8s,,,
Performance Testing,Core Web Vitals,TEST-083,Medium,TRUE,Time to Interactive (TTI) < 3.8s,,,
Performance Testing,Database Performance,TEST-084,High,TRUE,Database queries optimized (use select_related/prefetch_related),,,
Performance Testing,Database Performance,TEST-085,High,TRUE,No N+1 query problems,,,
Performance Testing,Database Performance,TEST-086,High,TRUE,Database indexes on foreign keys,,,
Performance Testing,Database Performance,TEST-087,High,TRUE,Pagination implemented on list views,,,
Performance Testing,Database Performance,TEST-088,Medium,TRUE,Efficient filtering on search pages,,,
Performance Testing,API Performance,TEST-089,High,TRUE,API response times < 500ms,,,
Performance Testing,API Performance,TEST-090,High,TRUE,Proper pagination on API endpoints,,,
Performance Testing,API Performance,TEST-091,Medium,TRUE,Efficient serialization,,,
Performance Testing,API Performance,TEST-092,Medium,TRUE,No unnecessary data in responses,,,
Performance Testing,Frontend Performance,TEST-093,Medium,TRUE,Infinite scroll works smoothly,,,
Performance Testing,Frontend Performance,TEST-094,Medium,TRUE,Image optimization (proper formats sizes),,,
Performance Testing,Frontend Performance,TEST-095,Low,TRUE,Splide carousels load efficiently,,,
Performance Testing,Frontend Performance,TEST-096,Medium,TRUE,No blocking JavaScript,,,
Performance Testing,Frontend Performance,TEST-097,Medium,TRUE,Proper use of async/defer on scripts,,,
Accessibility Testing,ARIA Attributes,TEST-098,High,TRUE,All interactive elements have ARIA labels,,,
Accessibility Testing,ARIA Attributes,TEST-099,High,TRUE,Form inputs have aria-required where needed,,,
Accessibility Testing,ARIA Attributes,TEST-100,High,TRUE,Error messages have aria-live regions,,,
Accessibility Testing,ARIA Attributes,TEST-101,High,TRUE,Modal dialogs have proper ARIA roles,,,
Accessibility Testing,ARIA Attributes,TEST-102,Medium,TRUE,Navigation landmarks defined,,,
Accessibility Testing,ARIA Attributes,TEST-103,Medium,TRUE,Loading states announced to screen readers,,,
Accessibility Testing,Keyboard Navigation,TEST-104,Critical,TRUE,All interactive elements keyboard accessible,,,
Accessibility Testing,Keyboard Navigation,TEST-105,High,TRUE,Tab order logical and intuitive,,,
Accessibility Testing,Keyboard Navigation,TEST-106,High,TRUE,Focus indicators visible,,,
Accessibility Testing,Keyboard Navigation,TEST-107,High,TRUE,Escape key closes modals,,,
Accessibility Testing,Keyboard Navigation,TEST-108,High,TRUE,Enter key submits forms,,,
Accessibility Testing,Keyboard Navigation,TEST-109,Low,TRUE,Keyboard shortcuts work (if implemented),,,
Accessibility Testing,Screen Reader Compatibility,TEST-110,High,TRUE,All images have descriptive alt text,,,
Accessibility Testing,Screen Reader Compatibility,TEST-111,High,TRUE,Form labels properly associated,,,
Accessibility Testing,Screen Reader Compatibility,TEST-112,High,TRUE,Error messages read aloud,,,
Accessibility Testing,Screen Reader Compatibility,TEST-113,Medium,TRUE,Status changes announced,,,
Accessibility Testing,Screen Reader Compatibility,TEST-114,Medium,TRUE,Decorative elements hidden from screen readers,,,
Accessibility Testing,WCAG 2.1 Compliance,TEST-115,High,TRUE,Color contrast ratios meet WCAG AA standards,,,
Accessibility Testing,WCAG 2.1 Compliance,TEST-116,Medium,TRUE,Text resizable up to 200% without breaking layout,,,
Accessibility Testing,WCAG 2.1 Compliance,TEST-117,Medium,TRUE,No content flashes (flash threshold < 3 per second),,,
Accessibility Testing,WCAG 2.1 Compliance,TEST-118,High,TRUE,Error identification and suggestions provided,,,
Accessibility Testing,WCAG 2.1 Compliance,TEST-119,High,TRUE,Form validation messages clear and helpful,,,
Accessibility Testing,Semantic HTML,TEST-120,Medium,TRUE,Proper heading hierarchy (h1 → h2 → h3),,,
Accessibility Testing,Semantic HTML,TEST-121,Low,TRUE,Lists use proper list elements,,,
Accessibility Testing,Semantic HTML,TEST-122,Medium,TRUE,Forms use proper form elements,,,
Accessibility Testing,Semantic HTML,TEST-123,Medium,TRUE,Buttons vs links used correctly,,,
Accessibility Testing,Semantic HTML,TEST-124,Medium,TRUE,Tables have proper headers,,,
Functional Testing,Core Pages - Home Page,TEST-125,High,TRUE,Hero section displays correctly,,,
Functional Testing,Core Pages - Home Page,TEST-126,Critical,TRUE,Search functionality works,,,
Functional Testing,Core Pages - Home Page,TEST-127,High,TRUE,Property type filters work,,,
Functional Testing,Core Pages - Home Page,TEST-128,Medium,TRUE,Trust badges display,,,
Functional Testing,Core Pages - Home Page,TEST-129,Medium,TRUE,Featured sections render,,,
Functional Testing,Core Pages - Home Page,TEST-130,Medium,TRUE,Splide carousels function,,,
Functional Testing,Core Pages - Home Page,TEST-131,High,TRUE,Links navigate correctly,,,
Functional Testing,Core Pages - Home Page,TEST-132,High,TRUE,CTAs work,,,
Functional Testing,Core Pages - Home Page,TEST-133,Medium,TRUE,Analytics tracking fires,,,
Functional Testing,Core Pages - About Us,TEST-134,Medium,TRUE,Page loads correctly,,,
Functional Testing,Core Pages - About Us,TEST-135,Medium,TRUE,All sections display,,,
Functional Testing,Core Pages - About Us,TEST-136,Low,TRUE,Images load,,,
Functional Testing,Core Pages - About Us,TEST-137,Medium,TRUE,Links work,,,
Functional Testing,Core Pages - About Us,TEST-138,Low,TRUE,Meta tags present,,,
Functional Testing,Core Pages - Contact Us,TEST-139,High,TRUE,Contact form displays,,,
Functional Testing,Core Pages - Contact Us,TEST-140,High,TRUE,Form validation works,,,
Functional Testing,Core Pages - Contact Us,TEST-141,High,TRUE,Form submission succeeds,,,
Functional Testing,Core Pages - Contact Us,TEST-142,High,TRUE,Success message shows,,,
Functional Testing,Core Pages - Contact Us,TEST-143,High,TRUE,Error handling works,,,
Functional Testing,Core Pages - Contact Us,TEST-144,High,TRUE,Zoho CRM sync works (if enabled),,,
Functional Testing,Core Pages - Contact Us,TEST-145,Medium,TRUE,Email sent confirmation,,,
Functional Testing,Core Pages - Privacy Policy,TEST-146,Low,TRUE,Page loads,,,
Functional Testing,Core Pages - Privacy Policy,TEST-147,Low,TRUE,Content displays correctly,,,
Functional Testing,Core Pages - Privacy Policy,TEST-148,Low,TRUE,Meta tags include noindex,,,
Functional Testing,Core Pages - 404 Error Page,TEST-149,Medium,TRUE,Custom 404 displays for invalid URLs,,,
Functional Testing,Core Pages - 404 Error Page,TEST-150,Medium,TRUE,Navigation options work,,,
Functional Testing,Core Pages - 404 Error Page,TEST-151,Medium,TRUE,Helpful error message shown,,,
Functional Testing,User Authentication - Signup,TEST-152,Critical,TRUE,Signup form displays,,,
Functional Testing,User Authentication - Signup,TEST-153,Critical,TRUE,Email validation works,,,
Functional Testing,User Authentication - Signup,TEST-154,Critical,TRUE,Password requirements enforced,,,
Functional Testing,User Authentication - Signup,TEST-155,High,TRUE,User type selection works,,,
Functional Testing,User Authentication - Signup,TEST-156,Critical,TRUE,Form submission creates user,,,
Functional Testing,User Authentication - Signup,TEST-157,Critical,TRUE,Email verification sent,,,
Functional Testing,User Authentication - Signup,TEST-158,High,TRUE,Redirects to email verification page,,,
Functional Testing,User Authentication - Signup,TEST-159,Medium,TRUE,Google OAuth signup works,,,
Functional Testing,User Authentication - Login,TEST-160,Critical,TRUE,Login form displays,,,
Functional Testing,User Authentication - Login,TEST-161,Critical,TRUE,Valid credentials log in user,,,
Functional Testing,User Authentication - Login,TEST-162,High,TRUE,Invalid credentials show error,,,
Functional Testing,User Authentication - Login,TEST-163,Low,TRUE,Remember me functionality (if implemented),,,
Functional Testing,User Authentication - Login,TEST-164,High,TRUE,Redirects to dashboard after login,,,
Functional Testing,User Authentication - Login,TEST-165,Medium,TRUE,Google OAuth login works,,,
Functional Testing,User Authentication - Login,TEST-166,Low,TRUE,PostHog login tracking fires,,,
Functional Testing,User Authentication - Email Verification,TEST-167,High,TRUE,Verification page displays,,,
Functional Testing,User Authentication - Email Verification,TEST-168,Critical,TRUE,Verification link works,,,
Functional Testing,User Authentication - Email Verification,TEST-169,High,TRUE,Invalid token shows error,,,
Functional Testing,User Authentication - Email Verification,TEST-170,Medium,TRUE,Resend email works,,,
Functional Testing,User Authentication - Email Verification,TEST-171,High,TRUE,Redirects after verification,,,
Functional Testing,User Authentication - Profile Completion,TEST-172,High,TRUE,Profile form displays based on user type,,,
Functional Testing,User Authentication - Profile Completion,TEST-173,High,TRUE,Required fields validated,,,
Functional Testing,User Authentication - Profile Completion,TEST-174,Medium,TRUE,Google Maps autocomplete works (address),,,
Functional Testing,User Authentication - Profile Completion,TEST-175,High,TRUE,Form submission updates profile,,,
Functional Testing,User Authentication - Profile Completion,TEST-176,High,TRUE,Redirects to dashboard after completion,,,
Functional Testing,User Authentication - Profile Completion,TEST-177,High,TRUE,Middleware enforces completion,,,
Functional Testing,User Authentication - Profile Settings,TEST-178,Medium,TRUE,Settings page loads,,,
Functional Testing,User Authentication - Profile Settings,TEST-179,High,TRUE,Form pre-populated with user data,,,
Functional Testing,User Authentication - Profile Settings,TEST-180,High,TRUE,Updates save correctly,,,
Functional Testing,User Authentication - Profile Settings,TEST-181,High,TRUE,Password change works,,,
Functional Testing,User Authentication - Profile Settings,TEST-182,Medium,TRUE,Email change works (if allowed),,,
Functional Testing,User Authentication - Profile Settings,TEST-183,Medium,TRUE,Image uploads work,,,
Functional Testing,User Authentication - Forgot Password,TEST-184,High,TRUE,Form displays,,,
Functional Testing,User Authentication - Forgot Password,TEST-185,High,TRUE,Email validation works,,,
Functional Testing,User Authentication - Forgot Password,TEST-186,High,TRUE,Reset email sent,,,
Functional Testing,User Authentication - Forgot Password,TEST-187,Critical,TRUE,Reset link works,,,
Functional Testing,User Authentication - Forgot Password,TEST-188,Critical,TRUE,New password can be set,,,
Functional Testing,User Authentication - Forgot Password,TEST-189,Medium,TRUE,Success message shows,,,
Functional Testing,User Authentication - Logout,TEST-190,High,TRUE,Logout button works,,,
Functional Testing,User Authentication - Logout,TEST-191,High,TRUE,Session cleared,,,
Functional Testing,User Authentication - Logout,TEST-192,Medium,TRUE,Redirects to login,,,
Functional Testing,User Authentication - Logout,TEST-193,Low,TRUE,PostHog user reset fires,,,
Functional Testing,Property Module - Property List,TEST-194,High,TRUE,Properties list displays,,,
Functional Testing,Property Module - Property List,TEST-195,High,TRUE,Infinite scroll works,,,
Functional Testing,Property Module - Property List,TEST-196,High,TRUE,Property cards render correctly,,,
Functional Testing,Property Module - Property List,TEST-197,Medium,TRUE,Filters work (if implemented),,,
Functional Testing,Property Module - Property List,TEST-198,Medium,TRUE,Empty state shows when no properties,,,
Functional Testing,Property Module - Property List,TEST-199,High,TRUE,Edit/Delete buttons work (if user owns),,,
Functional Testing,Property Module - Property List,TEST-200,Low,TRUE,Analytics tracking fires,,,
Functional Testing,Property Module - Create Property,TEST-201,High,TRUE,Form displays all fields,,,
Functional Testing,Property Module - Create Property,TEST-202,High,TRUE,Building selection works,,,
Functional Testing,Property Module - Create Property,TEST-203,High,TRUE,Form validation works,,,
Functional Testing,Property Module - Create Property,TEST-204,High,TRUE,Image uploads work,,,
Functional Testing,Property Module - Create Property,TEST-205,High,TRUE,Multiple images can be uploaded,,,
Functional Testing,Property Module - Create Property,TEST-206,Medium,TRUE,Video uploads work,,,
Functional Testing,Property Module - Create Property,TEST-207,Low,TRUE,AI description generation works (if enabled),,,
Functional Testing,Property Module - Create Property,TEST-208,High,TRUE,Form submission creates property,,,
Functional Testing,Property Module - Create Property,TEST-209,High,TRUE,Redirects after creation,,,
Functional Testing,Property Module - Create Property,TEST-210,Medium,TRUE,Success message shows,,,
Functional Testing,Property Module - Update Property,TEST-211,High,TRUE,Form pre-populated with existing data,,,
Functional Testing,Property Module - Update Property,TEST-212,High,TRUE,Updates save correctly,,,
Functional Testing,Property Module - Update Property,TEST-213,Medium,TRUE,Image deletion works,,,
Functional Testing,Property Module - Update Property,TEST-214,High,TRUE,New images can be added,,,
Functional Testing,Property Module - Update Property,TEST-215,High,TRUE,All fields update correctly,,,
Functional Testing,Property Module - Update Property,TEST-216,Medium,TRUE,Redirects after update,,,
Functional Testing,Property Module - Property Detail,TEST-217,Critical,TRUE,Property details display correctly,,,
Functional Testing,Property Module - Property Detail,TEST-218,High,TRUE,Gallery carousel works (Splide),,,
Functional Testing,Property Module - Property Detail,TEST-219,Medium,TRUE,Video playback works,,,
Functional Testing,Property Module - Property Detail,TEST-220,High,TRUE,All property information shows,,,
Functional Testing,Property Module - Property Detail,TEST-221,High,TRUE,Building information displays,,,
Functional Testing,Property Module - Property Detail,TEST-222,Medium,TRUE,Developer/Agent info shows,,,
Functional Testing,Property Module - Property Detail,TEST-223,Low,TRUE,Map displays (if implemented),,,
Functional Testing,Property Module - Property Detail,TEST-224,Medium,TRUE,Reviews section works,,,
Functional Testing,Property Module - Property Detail,TEST-225,High,TRUE,Favorite button works,,,
Functional Testing,Property Module - Property Detail,TEST-226,High,TRUE,Compare button works,,,
Functional Testing,Property Module - Property Detail,TEST-227,High,TRUE,Schedule viewing button works,,,
Functional Testing,Property Module - Property Detail,TEST-228,Low,TRUE,Share functionality works,,,
Functional Testing,Property Module - Property Detail,TEST-229,Low,TRUE,Analytics tracking fires,,,
Functional Testing,Property Module - Property Detail,TEST-230,Medium,TRUE,SEO meta tags present,,,
Functional Testing,Property Module - Property Search,TEST-231,Critical,TRUE,Search page loads,,,
Functional Testing,Property Module - Property Search,TEST-232,High,TRUE,Filters panel works,,,
Functional Testing,Property Module - Property Search,TEST-233,Critical,TRUE,Search results display,,,
Functional Testing,Property Module - Property Search,TEST-234,High,TRUE,Infinite scroll works,,,
Functional Testing,Property Module - Property Search,TEST-235,High,TRUE,Property cards render,,,
Functional Testing,Property Module - Property Search,TEST-236,Medium,TRUE,Sort functionality works,,,
Functional Testing,Property Module - Property Search,TEST-237,Medium,TRUE,View toggle (list/map) works,,,
Functional Testing,Property Module - Property Search,TEST-238,Medium,TRUE,Filter chips work,,,
Functional Testing,Property Module - Property Search,TEST-239,Medium,TRUE,Clear filters works,,,
Functional Testing,Property Module - Property Search,TEST-240,Low,TRUE,Search analytics tracking fires,,,
Functional Testing,Property Module - Property Search with Map,TEST-241,Medium,TRUE,Map view loads,,,
Functional Testing,Property Module - Property Search with Map,TEST-242,Medium,TRUE,Properties display on map,,,
Functional Testing,Property Module - Property Search with Map,TEST-243,Medium,TRUE,Map markers clickable,,,
Functional Testing,Property Module - Property Search with Map,TEST-244,Medium,TRUE,List view toggle works,,,
Functional Testing,Property Module - Property Search with Map,TEST-245,Medium,TRUE,Map interactions work,,,
Functional Testing,Property Module - Comparison,TEST-246,High,TRUE,Comparison page loads,,,
